{
    "typeName": "MyCompany::S3::Bucket::MODULE",
    "description": "Schema for Module Fragment of type MyCompany::S3::Bucket::MODULE",
    "properties": {
        "Parameters": {
            "type": "object",
            "properties": {
                "KMSKeyAlias": {
                    "type": "object",
                    "properties": {
                        "Type": {
                            "type": "string"
                        },
                        "Description": {
                            "type": "string"
                        }
                    },
                    "required": [
                        "Type",
                        "Description"
                    ],
                    "description": "The alias for your KMS key. If you will leave this field empty KMS key alias won't be created along the key."
                },
                "ReadOnlyArn": {
                    "type": "object",
                    "properties": {
                        "Type": {
                            "type": "string"
                        },
                        "Description": {
                            "type": "string"
                        }
                    },
                    "required": [
                        "Type",
                        "Description"
                    ],
                    "description": "Provide ARN of an existing Principal (role) that will be granted with read only access to the S3 bucket (e.g. 'arn:aws:iam::123456789xxx:role/myS3ROrole'). If not specified, access will be granted to current AWS account:root only. CF deployment will fail and rollback for non-existing ARN."
                },
                "ReadWriteArn": {
                    "type": "object",
                    "properties": {
                        "Type": {
                            "type": "string"
                        },
                        "Description": {
                            "type": "string"
                        }
                    },
                    "required": [
                        "Type",
                        "Description"
                    ],
                    "description": "Provide ARN of an existing Principal (role) that will be granted with read and write access to the S3 bucket (e.g. 'arn:aws:iam::123456789xxx:role/myS3RWrole'). If not specified, access will be granted to current AWS account:root only. CF deployment will fail and rollback for non-existing ARN."
                }
            }
        },
        "Resources": {
            "properties": {
                "KmsKey": {
                    "type": "object",
                    "properties": {
                        "Type": {
                            "type": "string",
                            "const": "AWS::KMS::Key"
                        },
                        "Properties": {
                            "type": "object"
                        }
                    }
                },
                "KmsKeyAlias": {
                    "type": "object",
                    "properties": {
                        "Type": {
                            "type": "string",
                            "const": "AWS::KMS::Alias"
                        },
                        "Properties": {
                            "type": "object"
                        }
                    }
                },
                "Bucket": {
                    "type": "object",
                    "properties": {
                        "Type": {
                            "type": "string",
                            "const": "AWS::S3::Bucket"
                        },
                        "Properties": {
                            "type": "object"
                        }
                    }
                },
                "BucketPolicy": {
                    "type": "object",
                    "properties": {
                        "Type": {
                            "type": "string",
                            "const": "AWS::S3::BucketPolicy"
                        },
                        "Properties": {
                            "type": "object"
                        }
                    }
                }
            },
            "type": "object",
            "additionalProperties": false
        }
    },
    "additionalProperties": true
}
